{
  "schema_version": "1.0",
  "inventory_id": "secret_root_inventory",
  "provider_id": "platform-secret-root",
  "flow_id": "provision-secrets-manager-kms-or-hsm-roots-and-access-policies",
  "policy_version": "1.0",
  "run_id": "run-template-secret-root-001",
  "workspace_id": "wk-template-secret-root-topology",
  "operator_identity_alias": "ops.security.template",
  "selection_status": "PROVIDER_SELECTION_REQUIRED",
  "selected_provider_stack_id_or_null": null,
  "root_posture": "LOGICAL_TOPOLOGY_FROZEN_PROVIDER_UNRESOLVED",
  "phase_hsm_requirement": "CLOUD_KMS_OR_MANAGED_HSM_CAPABLE_ROOT_SATISFIES_PHASE_01",
  "provider_stack_options": [
    {
      "stack_id": "AWS_SECRETS_MANAGER_KMS_CLOUDHSM",
      "provider_label": "AWS Secrets Manager + AWS KMS + optional CloudHSM",
      "selection_state": "BLOCKED_BY_PLATFORM_PROVIDER_SELECTION",
      "secret_store_summary": "Secrets Manager stores values under KMS-backed envelope encryption and supports customer-managed KMS keys.",
      "key_root_summary": "AWS KMS customer-managed symmetric keys can protect secret data keys and support rotation; CloudHSM remains a stricter option for exceptional requirements.",
      "hsm_summary": "Dedicated CloudHSM is available but not required by the current corpus before a platform decision exists.",
      "soft_delete_summary": "Secret deletion and recovery windows must be treated as provider recovery features, not as evidence that a revoked alias is still active.",
      "docs_urls": [
        "https://docs.aws.amazon.com/secretsmanager/latest/userguide/data-protection.html",
        "https://docs.aws.amazon.com/secretsmanager/latest/userguide/security-encryption.html",
        "https://docs.aws.amazon.com/kms/latest/developerguide/rotate-keys.html"
      ],
      "source_refs": [
        {
          "source_ref": "Algorithm/security_and_runtime_hardening_contract.md::secret-law",
          "rationale": "Secret, key, and token handling requires least privilege, no raw secret leakage, and explicit runtime hardening boundaries."
        },
        {
          "source_ref": "Algorithm/deployment_and_resilience_contract.md::token-vault-kms-hsm",
          "rationale": "Recovery, restore, and operational emergency handling requires a governed token-vault and key-root boundary."
        },
        {
          "source_ref": "Algorithm/observability_and_audit_contract.md::audit-redaction",
          "rationale": "Audit evidence must remain lineage-bound while logs and telemetry stay free of raw secrets."
        },
        {
          "source_ref": "Algorithm/manifest_and_config_freeze_contract.md::deterministic-config",
          "rationale": "Provider, environment, and config identity must remain deterministic and machine-readable."
        },
        {
          "source_ref": "Algorithm/schemas/secret_version.schema.json",
          "rationale": "Supersession and lineage must remain append-only instead of mutating a single active secret record in place."
        },
        {
          "source_ref": "docs/security/33_provisioning_credential_capture_rotation_and_secret_storage_policy.md",
          "rationale": "The provisioning secret pack already fixed capture, redaction, and cutover law that this root topology must now enforce structurally."
        }
      ],
      "fit_notes": [
        "Strong fit if the later storage/eventing platform resolves to AWS.",
        "KMS and CloudHSM separation matches the required distinction between secret storage, key wrapping, and hardware roots."
      ]
    },
    {
      "stack_id": "GCP_SECRET_MANAGER_CLOUD_KMS_HSM",
      "provider_label": "Google Secret Manager + Cloud KMS + Cloud HSM",
      "selection_state": "BLOCKED_BY_PLATFORM_PROVIDER_SELECTION",
      "secret_store_summary": "Secret Manager supports CMEK and uses the primary Cloud KMS key version for new encrypted secret versions.",
      "key_root_summary": "Cloud KMS provides customer-managed keys and can use HSM-backed protection levels when required.",
      "hsm_summary": "Cloud HSM-backed keys satisfy the current phase without forcing a separate dedicated HSM decision now.",
      "soft_delete_summary": "Rotation creates new primary key versions but does not retroactively rewrite every historical secret version, so lineage must stay explicit.",
      "docs_urls": [
        "https://docs.cloud.google.com/secret-manager/docs/cmek",
        "https://docs.cloud.google.com/kms/docs/hsm",
        "https://docs.cloud.google.com/kms/docs/use-keys-google-cloud"
      ],
      "source_refs": [
        {
          "source_ref": "Algorithm/security_and_runtime_hardening_contract.md::secret-law",
          "rationale": "Secret, key, and token handling requires least privilege, no raw secret leakage, and explicit runtime hardening boundaries."
        },
        {
          "source_ref": "Algorithm/deployment_and_resilience_contract.md::token-vault-kms-hsm",
          "rationale": "Recovery, restore, and operational emergency handling requires a governed token-vault and key-root boundary."
        },
        {
          "source_ref": "Algorithm/observability_and_audit_contract.md::audit-redaction",
          "rationale": "Audit evidence must remain lineage-bound while logs and telemetry stay free of raw secrets."
        },
        {
          "source_ref": "Algorithm/manifest_and_config_freeze_contract.md::deterministic-config",
          "rationale": "Provider, environment, and config identity must remain deterministic and machine-readable."
        },
        {
          "source_ref": "Algorithm/schemas/secret_version.schema.json",
          "rationale": "Supersession and lineage must remain append-only instead of mutating a single active secret record in place."
        },
        {
          "source_ref": "docs/security/33_provisioning_credential_capture_rotation_and_secret_storage_policy.md",
          "rationale": "The provisioning secret pack already fixed capture, redaction, and cutover law that this root topology must now enforce structurally."
        }
      ],
      "fit_notes": [
        "Strong fit if the future platform resolves to GCP.",
        "CMEK location matching must remain explicit for runtime and authority partitions."
      ]
    },
    {
      "stack_id": "AZURE_KEY_VAULT_MANAGED_HSM",
      "provider_label": "Azure Key Vault + Managed HSM",
      "selection_state": "BLOCKED_BY_PLATFORM_PROVIDER_SELECTION",
      "secret_store_summary": "Key Vault supports secret storage with soft-delete defaults and separate key material handling.",
      "key_root_summary": "Managed HSM provides a distinct hardware-backed boundary for keys while Key Vault keeps the secret namespace layer separate.",
      "hsm_summary": "Managed HSM is a valid way to satisfy stronger hardware-root expectations without forcing that choice before Azure is selected.",
      "soft_delete_summary": "Soft-delete and purge protection require an explicit revoke-vs-recovery posture so revoked versions never regain active use.",
      "docs_urls": [
        "https://learn.microsoft.com/en-us/azure/key-vault/keys/about-keys",
        "https://learn.microsoft.com/en-us/azure/key-vault/managed-hsm/",
        "https://learn.microsoft.com/en-us/azure/key-vault/general/soft-delete-overview"
      ],
      "source_refs": [
        {
          "source_ref": "Algorithm/security_and_runtime_hardening_contract.md::secret-law",
          "rationale": "Secret, key, and token handling requires least privilege, no raw secret leakage, and explicit runtime hardening boundaries."
        },
        {
          "source_ref": "Algorithm/deployment_and_resilience_contract.md::token-vault-kms-hsm",
          "rationale": "Recovery, restore, and operational emergency handling requires a governed token-vault and key-root boundary."
        },
        {
          "source_ref": "Algorithm/observability_and_audit_contract.md::audit-redaction",
          "rationale": "Audit evidence must remain lineage-bound while logs and telemetry stay free of raw secrets."
        },
        {
          "source_ref": "Algorithm/manifest_and_config_freeze_contract.md::deterministic-config",
          "rationale": "Provider, environment, and config identity must remain deterministic and machine-readable."
        },
        {
          "source_ref": "Algorithm/schemas/secret_version.schema.json",
          "rationale": "Supersession and lineage must remain append-only instead of mutating a single active secret record in place."
        },
        {
          "source_ref": "docs/security/33_provisioning_credential_capture_rotation_and_secret_storage_policy.md",
          "rationale": "The provisioning secret pack already fixed capture, redaction, and cutover law that this root topology must now enforce structurally."
        }
      ],
      "fit_notes": [
        "Strong fit if the platform later resolves to Azure.",
        "Recovery windows and purge authorization need explicit break-glass governance."
      ]
    },
    {
      "stack_id": "HASHICORP_VAULT_AUTO_UNSEAL",
      "provider_label": "HashiCorp Vault with cloud KMS/HSM auto-unseal",
      "selection_state": "SELF_HOST_DECISION_REQUIRED",
      "secret_store_summary": "Vault can provide a dedicated logical secret boundary with separate policies, leases, and audit devices.",
      "key_root_summary": "Vault auto-unseal can delegate the root unseal boundary to a cloud KMS or HSM while preserving Vault policy isolation.",
      "hsm_summary": "A self-hosted stack adds operational burden and is lawful only if later platform work explicitly chooses it.",
      "soft_delete_summary": "Version retention and revocation posture stay under Taxat policy rather than a cloud secret-service default.",
      "docs_urls": [
        "https://developer.hashicorp.com/vault/docs/about-vault/how-vault-works",
        "https://developer.hashicorp.com/vault/docs/secrets",
        "https://developer.hashicorp.com/vault/docs/secrets/kv"
      ],